{
  "family": "tracing",
  "fixture_id": "go-service-synthetic",
  "oracle_id": "panel-t3",
  "prompt": "Trace SERVICE_MODE and mode=lower from startup configuration to formatting. Give the package boundaries, call order and executable output. Write your answer to BENCHMARK_ANSWER.md and stop.",
  "reference_anchors": [
    "Resolve",
    "Format",
    "main"
  ],
  "result_format": "text",
  "result_path": "BENCHMARK_ANSWER.md",
  "schema_version": "1.0",
  "split": "holdout",
  "task_id": "panel-t3",
  "visibility": "public"
}
