{
  "family": "impact",
  "fixture_id": "codira-public",
  "oracle_id": "panel-i1",
  "prompt": "Assess a change to MCPAdapter._query. List every direct caller, the warm connection executor, operations that bypass it, and relevant tests. Label dynamic uncertainty. Write your answer to BENCHMARK_ANSWER.md and stop.",
  "reference_anchors": [
    "_query",
    "_ConnectionExecutor",
    "capabilities",
    "index_status"
  ],
  "result_format": "text",
  "result_path": "BENCHMARK_ANSWER.md",
  "schema_version": "1.0",
  "split": "development",
  "task_id": "panel-i1",
  "visibility": "public"
}
