{"schema_version":"1.0","task_id":"localize-001","fixture_id":"click-public","prompt":"Diagnose the copying and pickling failure for unset Click option defaults. Write structured evidence to .benchmark/result.json.","result_path":".benchmark/result.json","oracle_id":"localize-001","visibility":"public"}
