{"schema_version":"1.0","task_id":"architecture-001","fixture_id":"picomatch-public","prompt":"Write a concise architecture note to BENCHMARK_ANSWER.md describing Picomatch entry points and matcher, parser, and scanner relationships. Include the relevant source paths. Then stop.","result_path":"BENCHMARK_ANSWER.md","result_format":"text","oracle_id":"architecture-001","visibility":"public"}
