{"schema_version":"1.0","task_id":"documentation-001","fixture_id":"picomatch-public","prompt":"Write a concise Picomatch guide to BENCHMARK_GUIDE.md. Use the headings `# Matching`, `# Ignore`, and `# Case handling`; include practical examples. Then stop.","result_path":"BENCHMARK_GUIDE.md","result_format":"text","oracle_id":"documentation-001","visibility":"public"}
