{
  "family": "diagnosis",
  "fixture_id": "typescript-workspace-synthetic",
  "oracle_id": "panel-d3",
  "prompt": "Diagnose why format(text, {enabled:false}) changes case. Trace the wrapper boundary, explain the default rule and provide a reproduction. Write your answer to BENCHMARK_ANSWER.md and stop.",
  "reference_anchors": [
    "enabled",
    "convert",
    "transform"
  ],
  "result_format": "text",
  "result_path": "BENCHMARK_ANSWER.md",
  "schema_version": "1.0",
  "split": "holdout",
  "task_id": "panel-d3",
  "visibility": "public"
}
